{"schema":"mana.inspect.work-item/v1","work_item":{"work_item_id":"session:2026-05-30-main-audit","work_item_type":"session","external_ticket_id":{"value":null,"provenance":"explicit_workspace_manifest"},"title":{"value":null,"provenance":"unavailable"},"purpose":{"value":"repo-audit","provenance":"explicit_workspace_manifest"},"branch":{"value":"main","provenance":"explicit_workspace_manifest"},"canonical_branch":true,"lifecycle":{"state":"unknown","provenance":"unavailable","coverage":"unknown"},"review":{"state":"unknown","provenance":"unavailable","coverage":"unknown"},"attention_items":[],"artifacts":[{"artifact_id":"file:.mana/sessions/2026-05-30-main-audit/manifest.yaml","path":".mana/sessions/2026-05-30-main-audit/manifest.yaml","kind":"workspace_manifest","status":"available","work_item_id":"session:2026-05-30-main-audit","section_id":"artifacts","label":"Workspace manifest"}]},"sections":[{"section_id":"overview","artifacts":[],"summary":null},{"section_id":"requirements","artifacts":[],"summary":null},{"section_id":"plan","artifacts":[],"summary":null},{"section_id":"decisions","artifacts":[],"summary":null},{"section_id":"evidence","artifacts":[],"summary":null},{"section_id":"review","artifacts":[],"summary":null},{"section_id":"timeline","artifacts":[],"summary":null},{"section_id":"artifacts","artifacts":[],"summary":null}],"attention_items":[],"coverage":"canonical_workspace_artifacts","diagnostics":[],"guarantees":{"model_calls":0,"writes":false,"semantic_inference":"canonical_structured_sources_only"}}
