{"schema":"mana.inspect.work-item/v1","work_item":{"work_item_id":"feature:PROJ-24342","work_item_type":"feature","external_ticket_id":{"value":"PROJ-24342","provenance":"explicit_workspace_manifest"},"title":{"value":null,"provenance":"unavailable"},"purpose":{"value":"story-delivery","provenance":"explicit_workspace_manifest"},"branch":{"value":"feature/payment","provenance":"explicit_workspace_manifest"},"canonical_branch":false,"lifecycle":{"state":"in_progress","provenance":"canonical_path","coverage":"canonical_artifact_presence"},"review":{"state":"unknown","provenance":"unavailable","coverage":"unknown"},"attention_items":[],"artifacts":[{"artifact_id":"file:.mana/features/PROJ-24342/manifest.yaml","path":".mana/features/PROJ-24342/manifest.yaml","kind":"workspace_manifest","status":"available","work_item_id":"feature:PROJ-24342","section_id":"artifacts","label":"Workspace manifest"}]},"sections":[{"section_id":"overview","artifacts":[{"artifact_id":"file:.mana/features/PROJ-24342/index.md","path":".mana/features/PROJ-24342/index.md","kind":"markdown","status":"available","work_item_id":"feature:PROJ-24342","section_id":"overview","label":"Index"}],"summary":{"artifact_count":1}},{"section_id":"requirements","artifacts":[],"summary":null},{"section_id":"plan","artifacts":[],"summary":null},{"section_id":"decisions","artifacts":[],"summary":null},{"section_id":"evidence","artifacts":[{"artifact_id":"verification:run-1","path":".mana/features/PROJ-24342/evidence/verification/run-1/result.json","kind":"verification-result","status":"passed","work_item_id":"feature:PROJ-24342","section_id":"evidence","label":"Verification result"}],"summary":{"passed_count":1}},{"section_id":"review","artifacts":[],"summary":null},{"section_id":"timeline","artifacts":[],"summary":null},{"section_id":"artifacts","artifacts":[],"summary":null}],"attention_items":[],"coverage":"canonical_workspace_artifacts","diagnostics":[],"guarantees":{"model_calls":0,"writes":false,"semantic_inference":"canonical_structured_sources_only"}}
