{"schema":"mana.inspect.work-item/v1","work_item":{"work_item_id":"feature:unticketed","work_item_type":"feature","external_ticket_id":{"value":null,"provenance":"explicit_workspace_manifest"},"title":{"value":null,"provenance":"unavailable"},"purpose":{"value":null,"provenance":"unavailable"},"branch":{"value":null,"provenance":"unavailable"},"canonical_branch":null,"lifecycle":{"state":"unknown","provenance":"unavailable","coverage":"unknown"},"review":{"state":"unknown","provenance":"unavailable","coverage":"unknown"},"attention_items":[],"artifacts":[]},"sections":[{"section_id":"overview","artifacts":[],"summary":null}],"attention_items":[{"id":"pending-choice-1","category":"pending_decision","severity":"warning","work_item_id":"feature:unticketed","label":"Owner decision required","next_action":"Choose the database migration approach.","related_artifact_ids":["file:.mana/features/unticketed/decisions/developer-choice-log.md"],"provenance":"explicit_workspace_manifest"},{"id":"failed-verification-1","category":"failed_verification","severity":"error","work_item_id":"feature:unticketed","label":"Verification failed","next_action":null,"related_artifact_ids":["verification:run-failed"],"provenance":"explicit_workspace_manifest"},{"id":"stale-evidence-1","category":"stale_evidence","severity":"warning","work_item_id":"feature:unticketed","label":null,"next_action":null,"related_artifact_ids":["file:.mana/features/unticketed/evidence/index.md"],"provenance":"conservative_fallback"}],"coverage":"unknown","diagnostics":[{"id":"manifest-malformed","kind":"malformed_canonical_source","severity":"warning","provenance":"canonical_path","related_artifact_ids":["file:.mana/features/unticketed/manifest.yaml"]}],"guarantees":{"model_calls":0,"writes":false,"semantic_inference":"canonical_structured_sources_only"}}
